{
  "$schema": "https://json-schema.org/draft/2020-12/schema",
  "$id": "https://github.com/valon-technologies/gestalt/sdk/manifest/v1/manifest.v2.jsonschema.json",
  "type": "object",
  "additionalProperties": false,
  "required": [
    "schema_version",
    "source",
    "version",
    "kinds"
  ],
  "properties": {
    "schema_version": {
      "const": 2
    },
    "source": {
      "type": "string",
      "pattern": "^github\\.com/[a-z0-9][a-z0-9._-]*/[a-z0-9][a-z0-9._-]*/[a-z0-9][a-z0-9._-]*$"
    },
    "version": {
      "type": "string",
      "pattern": "^(0|[1-9]\\d*)\\.(0|[1-9]\\d*)\\.(0|[1-9]\\d*)(-[0-9A-Za-z-]+(\\.[0-9A-Za-z-]+)*)?(\\+[0-9A-Za-z-]+(\\.[0-9A-Za-z-]+)*)?$"
    },
    "display_name": {
      "type": "string"
    },
    "description": {
      "type": "string"
    },
    "kinds": {
      "type": "array",
      "minItems": 1,
      "uniqueItems": true,
      "items": {
        "enum": [
          "provider",
          "runtime",
          "webui"
        ]
      }
    },
    "provider": {
      "type": "object",
      "additionalProperties": false,
      "properties": {
        "protocol": {
          "type": "object",
          "additionalProperties": false,
          "required": [
            "min",
            "max"
          ],
          "properties": {
            "min": {
              "type": "integer",
              "minimum": 1
            },
            "max": {
              "type": "integer",
              "minimum": 1
            }
          }
        },
        "config_schema_path": {
          "type": "string",
          "minLength": 1
        },
        "auth": {
          "$ref": "#/$defs/provider_auth"
        },
        "mcp": {
          "type": "boolean"
        },
        "base_url": {
          "type": "string",
          "minLength": 1
        },
        "operations": {
          "type": "array",
          "minItems": 1,
          "items": {
            "$ref": "#/$defs/provider_operation"
          }
        }
      }
    },
    "webui": {
      "type": "object",
      "additionalProperties": false,
      "required": ["asset_root"],
      "properties": {
        "asset_root": {
          "type": "string",
          "minLength": 1
        }
      }
    },
    "artifacts": {
      "type": "array",
      "items": {
        "$ref": "#/$defs/artifact"
      }
    },
    "entrypoints": {
      "type": "object",
      "additionalProperties": false,
      "properties": {
        "provider": {
          "$ref": "#/$defs/entrypoint"
        },
        "runtime": {
          "$ref": "#/$defs/entrypoint"
        }
      }
    }
  },
  "allOf": [
    {
      "if": {
        "properties": {
          "kinds": {
            "contains": {
              "const": "provider"
            }
          }
        }
      },
      "then": {
        "required": [
          "provider"
        ],
        "anyOf": [
          {
            "required": [
              "artifacts",
              "entrypoints"
            ],
            "properties": {
              "entrypoints": {
                "required": [
                  "provider"
                ]
              },
              "provider": {
                "required": [
                  "protocol"
                ]
              }
            }
          },
          {
            "properties": {
              "provider": {
                "required": [
                  "base_url",
                  "operations"
                ]
              }
            }
          }
        ]
      }
    },
    {
      "if": {
        "properties": {
          "kinds": {
            "contains": {
              "const": "runtime"
            }
          }
        }
      },
      "then": {
        "required": [
          "artifacts",
          "entrypoints"
        ],
        "properties": {
          "entrypoints": {
            "required": [
              "runtime"
            ]
          }
        }
      }
    },
    {
      "if": {
        "properties": {
          "kinds": {
            "contains": {
              "const": "webui"
            }
          }
        }
      },
      "then": {
        "required": [
          "webui"
        ]
      }
    }
  ],
  "$defs": {
    "provider_auth": {
      "type": "object",
      "additionalProperties": false,
      "required": ["type"],
      "properties": {
        "type": {
          "type": "string",
          "enum": ["oauth2", "bearer", "manual", "none"]
        },
        "authorization_url": {
          "type": "string",
          "format": "uri"
        },
        "token_url": {
          "type": "string",
          "format": "uri"
        },
        "scopes": {
          "type": "array",
          "items": { "type": "string" }
        },
        "pkce": {
          "type": "boolean"
        },
        "client_auth": {
          "type": "string",
          "enum": ["header"]
        },
        "token_exchange": {
          "type": "string",
          "enum": ["form", "json"]
        },
        "scope_separator": {
          "type": "string"
        },
        "authorization_params": {
          "type": "object",
          "additionalProperties": { "type": "string" }
        }
      },
      "allOf": [
        {
          "if": {
            "properties": { "type": { "const": "oauth2" } }
          },
          "then": {
            "required": ["authorization_url", "token_url"]
          }
        }
      ]
    },
    "provider_operation": {
      "type": "object",
      "additionalProperties": false,
      "required": ["name", "method", "path"],
      "properties": {
        "name": {
          "type": "string",
          "minLength": 1
        },
        "description": {
          "type": "string"
        },
        "method": {
          "type": "string",
          "enum": ["GET", "POST", "PUT", "PATCH", "DELETE"]
        },
        "path": {
          "type": "string",
          "minLength": 1
        },
        "parameters": {
          "type": "array",
          "items": {
            "$ref": "#/$defs/provider_parameter"
          }
        }
      }
    },
    "provider_parameter": {
      "type": "object",
      "additionalProperties": false,
      "required": ["name", "type", "in"],
      "properties": {
        "name": {
          "type": "string",
          "minLength": 1
        },
        "type": {
          "type": "string",
          "enum": ["string", "int", "bool"]
        },
        "in": {
          "type": "string",
          "enum": ["query", "body", "path"]
        },
        "description": {
          "type": "string"
        },
        "required": {
          "type": "boolean"
        }
      }
    },
    "artifact": {
      "type": "object",
      "additionalProperties": false,
      "required": [
        "os",
        "arch",
        "path",
        "sha256"
      ],
      "properties": {
        "os": {
          "type": "string",
          "minLength": 1
        },
        "arch": {
          "type": "string",
          "minLength": 1
        },
        "path": {
          "type": "string",
          "minLength": 1
        },
        "sha256": {
          "type": "string",
          "pattern": "^[a-f0-9]{64}$"
        }
      }
    },
    "entrypoint": {
      "type": "object",
      "additionalProperties": false,
      "required": [
        "artifact_path"
      ],
      "properties": {
        "artifact_path": {
          "type": "string",
          "minLength": 1
        },
        "args": {
          "type": "array",
          "items": {
            "type": "string"
          }
        }
      }
    }
  }
}
