{
  "schema_version": 2,
  "source": "github.com/valon-technologies/gestalt/slack",
  "version": "0.0.1-alpha.2",
  "display_name": "Slack",
  "description": "Send messages, search conversations, and manage channels.",
  "kinds": ["provider"],
  "provider": {
    "protocol": { "min": 1, "max": 1 },
    "mcp": true,
    "auth": {
      "type": "oauth2",
      "authorization_url": "https://slack.com/oauth/v2/authorize",
      "token_url": "https://slack.com/api/oauth.v2.access",
      "scopes": ["channels:read", "channels:history", "chat:write", "users:read", "search:read"]
    }
  },
  "artifacts": [],
  "entrypoints": {}
}
